{
  "$schema": "./security-action-inventory.schema.json",
  "version": 1,
  "reviewed_commit": "184fbc8",
  "statuses": ["governed", "contained", "trusted-host-only", "intentionally-excluded", "open-bypass"],
  "sensitive_patterns": ["Command::new", "reqwest::", "TcpStream", "std::fs::", "tokio::fs::", "rusqlite", "docker", "wasmer", "env::var", "set_var", "remove_var"],
  "entries": [
    {
      "id": "SB-001",
      "title": "Anthropic streaming and JSON tool actions",
      "entrypoint": "POST /anthropic/v1/messages",
      "initiator": "model",
      "controlled_inputs": ["tool name", "tool arguments", "stream framing"],
      "operation": ["filesystem", "process", "network", "external-service", "evidence"],
      "privileges": "The broker may release a complete action to the Claude client after policy and receipt commit.",
      "enforcement_point": "Anthropic protocol gate, canonical ActionIntent policy, receipt-bound approval",
      "containment_boundary": "Protocol mediation only; actual execution containment depends on the client runtime.",
      "receipt_coverage": "Requested, approval_pending, denied, released, result_observed, or outcome_unknown.",
      "failure_behavior": "Malformed, unknown, disconnected, or unrecordable actions fail closed.",
      "platforms": ["windows", "macos", "linux"],
      "tests": ["guard_protocol::tests::anthropic_fixture_is_byte_exact_across_every_chunk_size", "server::tests::stream_policy_is_fail_closed_and_releases_only_an_explicit_exact_allow", "memory::tests::claude_guard_approval_is_single_use_and_receipt_chain_is_complete"],
      "source_files": ["kernel/src/guard_protocol.rs", "kernel/src/guard_policy.rs", "kernel/src/server.rs", "kernel/src/memory.rs"],
      "status": "governed",
      "risk": "P1",
      "remediation_task": 2,
      "evidence": "Policy and durable receipts are tested; protocol governance alone does not contain native client execution."
    },
    {
      "id": "SB-002",
      "title": "OpenAI Responses compatibility actions",
      "entrypoint": "POST /openai/v1/responses",
      "initiator": "model",
      "controlled_inputs": ["function calls", "custom tool calls", "shell calls", "patch calls"],
      "operation": ["filesystem", "process", "network", "external-service", "evidence"],
      "privileges": "Compatibility broker can release actions to an isolated Codex client configuration.",
      "enforcement_point": "OpenAI protocol gate and canonical policy adapter",
      "containment_boundary": "Not certified against a real current OpenAI provider stream.",
      "receipt_coverage": "Compatibility decision coverage; complete production receipt correlation is not claimed.",
      "failure_behavior": "Unknown actionable item types and malformed arguments fail closed.",
      "platforms": ["windows", "macos", "linux"],
      "tests": ["guard_protocol::tests::openai_fixture_extracts_current_codex_function_and_custom_actions", "guard_policy::tests::protocol_adapters_share_canonical_policy_decisions"],
      "source_files": ["kernel/src/guard_protocol.rs", "kernel/src/guard_policy.rs", "kernel/src/client.rs"],
      "status": "intentionally-excluded",
      "risk": "P1",
      "remediation_task": 8,
      "evidence": "Codex remains compatibility-only until provider-backed certification."
    },
    {
      "id": "SB-003",
      "title": "Explicitly degraded Claude host demo",
      "entrypoint": "kerna claude --host-demo and kerna demo start",
      "initiator": "agent",
      "controlled_inputs": ["native Bash", "native file tools", "client subprocess behavior", "repository instructions"],
      "operation": ["filesystem", "process", "network", "credential"],
      "privileges": "The current demo launches the npm Claude executable as a host process in a disposable clone.",
      "enforcement_point": "Model-seam policy observes model-issued actions, but cannot mediate every native client side effect.",
      "containment_boundary": "Disposable clone only; no complete OS/container boundary around the Claude host process.",
      "receipt_coverage": "Model-seam actions may be receipted; native actions outside the seam are not guaranteed to be observed.",
      "failure_behavior": "The CLI prints a degraded-containment warning; this path is excluded from production and pilot claims.",
      "platforms": ["windows", "macos"],
      "tests": ["client::tests::claude_and_codex_configs_pin_the_contract_working_directory"],
      "source_files": ["kernel/src/guard_launcher.rs", "kernel/src/demo_session.rs"],
      "status": "intentionally-excluded",
      "risk": "P1",
      "remediation_task": 4,
      "evidence": "The host path now requires an explicit --host-demo flag and prints that it is not structurally contained."
    },
    {
      "id": "SB-004",
      "title": "Governed MCP gateway calls",
      "entrypoint": "MCP tools/call over stdio or direct gateway",
      "initiator": "model",
      "controlled_inputs": ["server name", "tool name", "JSON arguments"],
      "operation": ["filesystem", "process", "network", "credential", "external-service", "evidence"],
      "privileges": "Gateway may invoke only registered tools within policy, manifest, budget, folder, and secret grants.",
      "enforcement_point": "Gateway canonical arguments, permission engine, single-use approval, mandatory receipts",
      "containment_boundary": "Docker is default; explicitly configured native servers run with host process authority.",
      "receipt_coverage": "Gateway sessions, decisions, approvals, result digests, and terminal state are durable.",
      "failure_behavior": "Unknown, denied, expired, over-budget, or unrecordable calls do not execute.",
      "platforms": ["windows", "macos", "linux"],
      "tests": ["gateway::tests::gateway_governs_and_records_proxied_calls", "gateway::tests::gateway_approval_is_bound_to_one_exact_retry", "trust_layer_validation::test_mcp_protocol_rejects_response_id_flood"],
      "source_files": ["kernel/src/gateway.rs", "kernel/src/mcp_governance.rs", "kernel/src/permissions.rs", "kernel/src/mcp_registry.rs"],
      "status": "governed",
      "risk": "P1",
      "remediation_task": 2,
      "evidence": "Governance is strong, but a configured native runtime is not a containment boundary."
    },
    {
      "id": "SB-005",
      "title": "MCP server process launch",
      "entrypoint": "gateway server startup",
      "initiator": "operator",
      "controlled_inputs": ["manifest command", "arguments", "environment grants", "mount grants", "runtime mode"],
      "operation": ["process", "filesystem", "network", "credential", "container"],
      "privileges": "Docker servers receive declared mounts and secrets; native servers inherit restricted but host-level process execution.",
      "enforcement_point": "Production manifest verification, capability validation, runtime-mode selection",
      "containment_boundary": "Pinned Docker image and disjoint mounts for production; no structural containment in native mode.",
      "receipt_coverage": "Tool calls are receipted; server process startup itself is operational evidence rather than an action receipt.",
      "failure_behavior": "Invalid production manifests fail closed; approved native configurations can still execute on the host.",
      "platforms": ["windows", "macos", "linux"],
      "tests": ["config::tests::production_plugin_contract_requires_digest_and_disjoint_roots", "plugin_manifest::tests::production_server_requires_a_valid_signed_manifest", "config::mcp_runtime_mode_tests::an_mcp_server_without_a_runtime_mode_runs_natively"],
      "source_files": ["kernel/src/mcp.rs", "kernel/src/config.rs", "kernel/src/plugin_manifest.rs"],
      "status": "open-bypass",
      "risk": "P1",
      "remediation_task": 4,
      "evidence": "Native mode is an intentional compatibility path but cannot support a contained production claim."
    },
    {
      "id": "SB-006",
      "title": "Contained filesystem tool pack",
      "entrypoint": "fs_read, fs_write, and fs_move gateway tools",
      "initiator": "model",
      "controlled_inputs": ["grant name", "relative path", "content", "source and destination"],
      "operation": ["filesystem", "evidence"],
      "privileges": "Resolved grant root with declared read-only or read-write authority.",
      "enforcement_point": "Canonical root resolution, traversal rejection, symlink containment, permission and approval checks",
      "containment_boundary": "Canonical filesystem root and Docker mount when the gateway runs contained.",
      "receipt_coverage": "Gateway receipt records decision and result digest without content.",
      "failure_behavior": "Unknown roots, traversal, absolute paths, symlink escapes, and read-only writes fail closed.",
      "platforms": ["windows", "macos", "linux"],
      "tests": ["folders::tests::safe_join_rejects_symlink_escape", "tool_packs::tests::fs_move_refused_on_readonly_grant_and_on_traversal", "gateway::tests::contained_filesystem_fixture_reads_and_approval_gates_real_writes"],
      "source_files": ["kernel/src/folders.rs", "kernel/src/tool_packs.rs"],
      "status": "contained",
      "risk": "P2",
      "remediation_task": 3,
      "evidence": "Path resolution and real read/write behavior have direct tests."
    },
    {
      "id": "SB-007",
      "title": "Wasmer and Tenki sandbox execution",
      "entrypoint": "kerna_sandbox_run and POST /kerna/sandbox",
      "initiator": "model",
      "controlled_inputs": ["backend", "language", "source code", "timeout"],
      "operation": ["process", "network", "external-service", "evidence"],
      "privileges": "Wasmer Node bridge or authenticated Tenki worker executes bounded Python code.",
      "enforcement_point": "Kerna pre-execution admission, backend allowlist, timeout, output cap, receipt commit",
      "containment_boundary": "Wasmer runtime or Tenki remote sandbox; keyword admission is defense-in-depth, not containment.",